{
  "module_id": "p4p.payment.chaospay-mock",
  "module_class": "payment",
  "lane": "public_capability",
  "type": "payment",
  "provider_id": "p4p.reference",
  "version": "0.1",
  "status": "internal-mock-planned",
  "description": "Internal payment chaos mock for future stress-testing of edge cases and invalid provider states.",
  "visibility": "operator_only",
  "capabilities": ["simulate_payment_edge_cases", "report_payment_state"],
  "input_events": ["PAYMENT_REQUIRED"],
  "output_events": ["PAYMENT_MODE_CHANGED", "PAYMENT_FAILED"],
  "permissions": [
    "read.order.summary",
    "write.payment.state"
  ],
  "blocking_policy": "blocking",
  "suggested_fallbacks": {
    "PAYMENT_FAILED": ["p4p.payment.cash", "p4p.notify.email"]
  },
  "idempotency_scope": "payment_attempt",
  "failure_modes": ["PAYMENT_FAILED"],
  "required_configuration": ["scenario"],
  "requires": [],
  "data_access": ["order_total", "order_status"],
  "entrypoint": null,
  "signature": null,
  "public_catalog": {
    "function": "Planned internal mock for ugly payment scenarios such as timeout, cancel, wrong amount, invalid signature, duplicate callback, late callback, and conflicting status.",
    "data_access_summary": "Order total and order state only. No customer funds, wallet data, card data, settlement, or real provider data.",
    "trust_status": "planned internal debug mock, not real payment",
    "readiness": "planned",
    "operator_status": "declared only; scenario executor intentionally not enabled yet"
  }
}
